MOVID,plot
102338.0,"The Shaolin Temple is the last place to resist defeat by the Manchu Dynasty, mostly because of their unique fighting style. Men from far and wide come to wait outside the temple, hoping that they will be admitted as pupils. As the Abbot becomes older, he realizes that the Manchus are determined to destroy the temple and eradicate the Shaolin fighting techniques. To this end, he decides that it is time at last to admit worthy men into the temple as students, to learn the way of Shaolin.::Murray Chapman <muzzle@cs.uq.oz.au>"
102378.0,"A slacker hatches a million-dollar idea. But, in order to see it through, he has to learn to trust his attractive corporate counterpart. Based on Max Barry's novel."
102407.0,"A writer and wall street trader, Nick, finds himself drawn to the past and lifestyle of his millionaire neighbor, Jay Gatsby."
102445.0,"After the crew of the Enterprise find an unstoppable force of terror from within their own organization, Captain Kirk leads a manhunt to a war-zone world to capture a one-man weapon of mass destruction."
102481.0,"Two salesmen whose careers have been torpedoed by the digital age find their way into a coveted internship at Google, where they must compete with a group of young, tech-savvy geniuses for a shot at employment."
102590.0,"Skip Lipman, a suburban stay at home dad, embarks on an epic quest to topple a mighty empire in a full-contact Live Action Role Playing Game known as Darkon."
102602.0,"Local Georgian pilot Mimino dreams of flying airplanes for major international airlines. To realize his aspirations, he goes to Moscow where he encounters a fellow comrade from the Caucasus, the Armenian Rubik. Many misadventures ensue."
102666.0,"An ordinary Soviet building manager, living in the 20th century, is extremely similar to Tsar of All Rus' - Ivan IV the Terrible (1530 - 1584). He would never have known about this, but one day his neighbor created a time machine."
102684.0,"Julian, a drug-smuggler thriving in Bangkok's criminal underworld, sees his life get even more complicated when his mother compels him to find and kill whoever is responsible for his brother's recent death."
102686.0,"When one of their own is kidnapped by an angry gangster, the Wolf Pack must track down Mr. Chow, who has escaped from prison and is on the run."
102716.0,"Hobbs has Dominic and Brian reassemble their crew to take down a team of mercenaries: Dominic unexpectedly gets sidetracked with facing his presumed deceased girlfriend, Letty."
102720.0,A teenager finds herself transported to a deep forest setting where a battle between the forces of good and the forces of evil is taking place. She bands together with a rag-tag group of characters in order to save their world -- and ours.
102735.0,A recipient of an experimental body enhancement chemical retaliates against his would be killers as a star spangled superhero.
102742.0,"The impact of the decline of heavy industry on workers and their families in the Tiexi district of Shenyang, China, at the turn of the 21st century, documented unflinchingly by a fly-on-the-wall camera."
102747.0,"After causing restaurant chaos at work, a bumbling waiter tears up the local roller rink with his skating."
102749.0,The star spangled hero must battle a villain's plan to poison America with a chemical that horrifically accelerates the aging process.
102760.0,A crime family looks to unmask the police informant in their midst who threatens to take down their business.
102800.0,"A New York woman (who doesn't really have an apartment) apprentices for a dance company (though she's not really a dancer) and throws herself headlong into her dreams, even as the possibility of realizing them dwindles."
102802.0,"Heidi, a radio DJ, is sent a box containing a record - a ""gift from the Lords"". The sounds within the grooves trigger flashbacks of her town's violent past. Is Heidi going mad, or are the Lords back to take revenge on Salem, Massachusetts?"
102819.0,A chronicle of the tempestuous six-year romance between megastar singer Liberace and his young lover Scott Thorson.
102823.0,Director Jonas Mekas provides an intimate glimpse of his personal life by constructing a feature length narrative from over 30 years of private home movie footage.
102852.0,The life and career of the comic book writer and editor.
102880.0,"A crash landing leaves Kitai Raige and his father Cypher stranded on Earth, a millennium after events forced humanity's escape. With Cypher injured, Kitai must embark on a perilous journey to signal for help."
102903.0,"An F.B.I. Agent and an Interpol Detective track a team of illusionists who pull off bank heists during their performances, and reward their audiences with the money."
102984.0,Six captive office workers are literally chained to their desks by deranged former regional manager Thomas Reddmann (Redd). He assigns his 'human resources' the impossible task of proving his innocence or suffering gruesome consequences.
102993.0,"Shy 14-year-old Duncan goes on summer vacation with his mother, her overbearing boyfriend, and her boyfriend's daughter. Having a rough time fitting in, Duncan finds an unexpected friend in Owen, manager of the Water Wizz water park."
103027.0,A modern retelling of Shakespeare's classic comedy about two pairs of lovers with different takes on romance and a way with words.
103042.0,"An alien child is evacuated from his dying world and sent to Earth to live among humans. His peace is threatened, when other survivors of his home planet invade Earth."
103048.0,"Three teenage friends, in the ultimate act of independence, decide to spend their summer building a house in the woods and living off the land."
103075.0,"A wealthy family is held hostage for harboring the target of a murderous syndicate during the Purge, a 12-hour period in which any and all crime is legal."
103085.0,Two teens battle their way through a religious apocalypse on a mission to defeat the Antichrist.
103107.0,"Backup singers live in a world that lies just beyond the spotlight. Their voices bring harmony to the biggest bands in popular music, but we've had no idea who these singers are or what lives they lead, until now."
103137.0,"Inspired by actual events, a group of fame-obsessed teenagers use the internet to track celebrities' whereabouts in order to rob their homes."
103141.0,"A look at the relationship between Mike Wazowski (Billy Crystal) and James P. ""Sully"" Sullivan (John Goodman) during their days at Monsters University, when they weren't necessarily the best of friends."
103171.0,"An employee at a professional separation agency, a business that helps couples break up, Paul tries to tackle the problems that come with Toto, the boyfriend of a customer, while he has his own thinking to do about love and relationships."
103210.0,"In the lost holy land of Milos, the Elrics search for the truth behind an unknown form of alchemy. What secrets are hidden in Milos? Riddles must be solved and dangers faced before the truth can be found."
103219.0,"As he helps a young artist with her upcoming exhibition, the owner of a mannequin shop's deadly, suppressed desires come to the surface."
103221.0,A young playboy who learns he has one month until he becomes infertile sets out to procreate as much as possible.
103228.0,"As a war between humankind and monstrous sea creatures wages on, a former pilot and a trainee are paired up to drive a seemingly obsolete special weapon in a desperate effort to save the world from the apocalypse."
103233.0,"When the Joker and Lex Luthor form an alliance, Batman must team up with the Justice League in order to stop them."
103235.0,A lonely art expert working for a mysterious and reclusive heiress finds not only her art worth examining.
103245.0,Adam and Eve start dating in college. Eve wants to remain a virgin until...? Neither Adam's nor Eve's roomies understand them.
103249.0,Former United Nations employee Gerry Lane traverses the world in a race against time to stop a zombie pandemic that is toppling armies and governments and threatens to destroy humanity itself.
103253.0,"In the year 2154, the very wealthy live on a man-made space station while the rest of the population resides on a ruined Earth. A man takes on a mission that could bring equality to the polarized worlds."
103335.0,"When Gru, the world's most super-bad turned super-dad has been recruited by a team of officials to stop lethal muscle and a host of Gru's own, He has to fight back with new gadgetry, cars, and more minion madness."
103339.0,"While on a tour of the White House with his young daughter, a Capitol policeman springs into action to save his child and protect the president from a heavily armed group of paramilitary invaders."
103341.0,Five friends who reunite in an attempt to top their epic pub crawl from twenty years earlier unwittingly become humanity's only hope for survival.
103366.0,A damaged ex-special forces soldier navigating London's criminal underworld seizes an opportunity to assume another man's identity.
103372.0,An uptight FBI Special Agent is paired with a foul-mouthed Boston cop to take down a ruthless drug lord.
103384.0,"Native American warrior Tonto recounts the untold tales that transformed John Reid, a man of the law, into a legend of justice."
103449.0,The rivalry between the manipulative boss of an advertising agency and her talented protégée escalates from stealing credit to public humiliation to murder.
103483.0,"Searching for a missing student, two private investigators break into his house and find collection of VHS tapes. Viewing the horrific contents of each cassette, they realize there may be dark motives behind the student's disappearance."
103502.0,A couple endures a series of mishaps right before their wedding day.
103539.0,"A hard-partying high school senior's philosophy on life changes when he meets the not-so-typical ""nice girl."""
103543.0,A former valedictorian quits her reporter job in New York and returns to the place she last felt happy: her childhood home in Connecticut. She gets work as a lifeguard and starts a dangerous relationship with a troubled teenager.
103596.0,"When a freak hurricane swamps Los Angeles, nature's deadliest killer rules sea, land, and air as thousands of sharks terrorize the waterlogged populace."
103602.0,"Craig Ferguson unleashes his trademark stream-of-consciousness comedy before a sold-out crowd, riffing on fatherhood, Helen of Troy and shark penises. His show's not safe for kids - or the easily offended!"
103606.0,"An acclaimed writer, his ex-wife, and their teenaged children come to terms with the complexities of love in all its forms over the course of one tumultuous year."
103609.0,A valedictorian and a juvenile delinquent have their school records switched and begin to be treated like the other.
103624.0,"The story of Oscar Grant III, a 22-year-old Bay Area resident, who crosses paths with friends, enemies, family, and strangers on the last day of 2008."
103655.0,A recently slain cop joins a team of undead police officers working for the Rest in Peace Department and tries to find the man who murdered him.
103685.0,"Amid the Civil War in 17th-century England, a group of deserters flee from battle through an overgrown field. Captured by an alchemist, the men are forced to help him search to find a hidden treasure that he believes is buried in the field."
103688.0,Paranormal investigators Ed and Lorraine Warren work to help a family terrorized by a dark presence in their farmhouse.
103755.0,A freak accident might just help an everyday garden snail achieve his biggest dream: winning the Indy 500.
103772.0,"Wolverine comes to Japan to meet an old friend whose life he saved years ago, and gets embroiled in a conspiracy involving yakuza and mutants."
103801.0,Luke and Kate are coworkers at a brewery who spend their nights drinking and flirting heavily. One weekend away together with their significant others proves who really belongs together and who doesn't.
103810.0,Retired CIA agent Frank Moses reunites his unlikely team of elite operatives for a global quest to track down a missing portable nuclear device.
103819.0,A website manager enlists the help of his two friends in order to convince the owners of his favorite coffee shop -- which doubles as his office -- not to turn their business into a bar.
103865.0,A man recruits his cousin to find out who is behind his dog's suspicious death.
103883.0,"Two hardened criminals get into trouble with the US border patrol after meeting with a Mexican drug lord, and then revelations start to unfold."
103980.0,"A New York socialite, deeply troubled and in denial, arrives in San Francisco to impose upon her sister. She looks a million, but isn't bringing money, peace, or love..."
103984.0,"Jep Gambardella has seduced his way through the lavish nightlife of Rome for decades, but after his 65th birthday and a shock from the past, Jep looks past the nightclubs and parties to find a timeless landscape of absurd, exquisite beauty."
104017.0,"Istanbul is being terrorized by a crime wave, and the police call in American superhero Captain America and Mexican wrestler Santo to put a stop to it."
104069.0,"In February, 2013, Louis brings his impish nihilism to Phoenix, Arizona. He talks about an old lady and her pet, living in Manhattan, experiencing his body's aging (he's 45), men's fascination with women's breasts, the beauty of living outside the food chain, his quickness to anger while driving, and murder. It's theater in the round, so he's in constant motion, a grin nearly always on his face.::<jhailey@hotmail.com>"
104074.0,"In order to restore their dying safe haven, the son of Poseidon and his friends embark on a quest to the Sea of Monsters, to find the mythical Golden Fleece, all the while trying to stop an ancient evil from rising."
104076.0,"The Smurfs team up with their human friends to rescue Smurfette, who has been abducted by Gargamel, since she knows a secret spell that can turn the evil sorcerer's newest creation, creatures called ""The Naughties"", into real Smurfs."
104078.0,"When famous DJ Alan Partridge's radio station is taken over by a new media conglomerate, it sets in motion a chain of events which see Alan having to work with the police to defuse a potentially violent siege."
104129.0,A young martial artist's unparalleled Tai Chi skills land him in a highly lucrative underworld fight club.
104141.0,"The Dark Knight must contend with a mysterious female vigilante who emulates him, but to a more ruthless degree."
104211.0,A veteran pot dealer creates a fake family as part of his plan to move a huge shipment of weed into the U.S. from Mexico.
104218.0,"After moving his family back to his hometown to be with his friends and their kids, Lenny finds out that between old bullies, new bullies, schizo bus drivers, drunk cops on skis, and four hundred costumed party crashers sometimes crazy follows you."
104241.0,"Following Kick-Ass' heroics, other citizens are inspired to become masked crusaders. But Red Mist leads his own group of evil supervillains to get revenge, kill Kick-Ass and destroy everything he stands for."
104243.0,"Left for dead on a sun-scorched planet, Riddick finds himself up against an alien race of predators. Activating an emergency beacon alerts two ships: one carrying a new breed of mercenary, the other captained by a man from Riddick's past."
104245.0,A cropdusting plane with a fear of heights lives his dream of competing in a famous around-the-world aerial race.
104272.0,"A documentary following the controversial captivity of killer whales, and its dangers for both humans and whales."
104283.0,"A look at the life of Jiro Horikoshi, the man who designed Japanese fighter planes during World War II."
104303.0,The story of Steve Jobs' ascension from college dropout into one of the most revered creative entrepreneurs of the 20th century.
104337.0,"As Cecil Gaines serves eight presidents during his tenure as a butler at the White House, the civil rights movement, Vietnam, and other major events affect this man's life, family, and American society."
104339.0,An underachieving voice coach finds herself competing in the movie trailer voice-over profession against her arrogant father and his protégé.
104374.0,"At the age of 21, Tim discovers he can travel in time and change what happens and has happened in his own life. His decision to make his world a better place by getting a girlfriend turns out not to be as easy as you might think."
104419.0,A good version of Lex Luthor from a parallel Earth comes to the Justice League's dimension for help to fight their evil counterparts.
104457.0,"When the Davison family comes under attack during their wedding anniversary getaway, the gang of mysterious killers soon learns that one of the victims harbors a secret talent for fighting back."
104644.0,"Spend an intimate evening with Maria Bamford in her cozy 'shot-at-home' comedy special. Gleeful, thrilling, and oh so awkward Maria gets snug with her two person audience consisting of only her parents."
104760.0,"To save his kidnapped wife, Brent Magna must drive at the orders of a mysterious man."
104780.0,A group of peaceful space explorers find out a trail of a mysterious plot.
104837.0,"Tanaka, a DEA agent, and his partner Ray are after a bunch of drug dealers. But they are betrayed by an insider and Ray is killed. Tanaka follows the culprit, a sadistic drug lord, down to Argentina."
104841.0,Two astronauts work together to survive after an accident leaves them stranded in space.
104863.0,"Wallace, who is burned out from a string of failed relationships, forms an instant bond with Chantry, who lives with her longtime boyfriend. Together, they puzzle out what it means if your best friend is also the love of your life."
104875.0,"The possibly exaggerated origin story of the real life alien bluegrass band, Future Folk, that has been playing for NYC audiences for the better part of a decade."
104879.0,"When Keller Dover's daughter and her friend go missing, he takes matters into his own hands as the police pursue multiple leads and the pressure mounts."
104906.0,"Obsessed with Pride and Prejudice (1995), a woman travels to a Jane Austen theme park in search for her perfect gentleman."
104908.0,"The Lamberts believe that they have defeated the spirits that have haunted their family, but they soon discover that evil is not beaten so easily."
104913.0,The merciless 1970s rivalry between Formula One rivals James Hunt and Niki Lauda.
104925.0,"The Manzoni family, a notorious mafia clan, is relocated to Normandy, France under the Witness Protection Program, where fitting in soon becomes challenging, as their old habits die hard."
104944.0,A 20-something supervising staff member of a residential treatment facility navigates the troubled waters of that world alongside her co-worker and longtime boyfriend.
105020.0,A Japanese investigator (Morita) and a Detroit cop (Leno) team up to track down a stolen prototype turbocharger.
105037.0,"Feeling pressured to become more sexually experienced before she goes to college, Brandy Klark makes a list of things to accomplish before hitting campus in the fall."
105121.0,"Years after he left Damascus under suspicious circumstances, Adib Abdel Kareem must confront what he left behind when his daughter goes missing."
105197.0,"An aging, booze-addled father makes the trip from Montana to Nebraska with his estranged son in order to claim a million-dollar Mega Sweepstakes Marketing prize."
105211.0,A divorced woman who decides to pursue the man she's interested in learns he's her new friend's ex-husband.
105213.0,"A New Jersey guy dedicated to his family, friends, and church, develops unrealistic expectations from watching porn and works to find happiness and intimacy with his potential true love."
105246.0,"Wealthy, inventive bachelor Colin endeavors to find a cure for his lover Chloe after she's diagnosed with an unusual illness caused by a flower growing in her lungs."
105250.0,A documentary about the rise of psychoanalysis as a powerful means of persuasion for both governments and corporations.
105254.0,"As Jamie travels in Chile, he invites an eccentric woman to join his group's quest to score a fabled hallucinogen, a move that finds him at odds with his new companion, until they drink the magic brew on a beach at the edge of the desert."
105325.0,A man learns that his unusual stomach pains are being caused by a demon living in his intestines.
105351.0,"When a poor college student who cracks an online poker game goes bust, he arranges a face-to-face with the man he thinks cheated him, a sly offshore entrepreneur."
105355.0,"Adèle's life is changed when she meets Emma, a young woman with blue hair, who will allow her to discover desire and to assert herself as a woman and as an adult. In front of others, Adèle grows, seeks herself, loses herself, and ultimately finds herself through love and loss."
105468.0,"Flint Lockwood now works at The Live Corp Company for his idol Chester V. But he's forced to leave his post when he learns that his most infamous machine is still operational, and is churning out menacing food-animal hybrids."
105504.0,"The true story of Captain Richard Phillips and the 2009 hijacking by Somali pirates of the U.S.-flagged MV Maersk Alabama, the first American cargo ship to be hijacked in two hundred years."
105540.0,Three canines itch and scratch their way through everything and anything in an effort to save Christmas from an evil spirit (Carface) who wants to use dogs from all over the world to ruin Christmas.
105585.0,The U.S. government recruits Machete to battle his way through Mexico in order to take down an arms dealer who looks to launch a weapon into space.
105593.0,"A corrupt, junkie cop with bipolar disorder attempts to manipulate his way through a promotion in order to win back his wife and daughter while also fighting his own inner demons."
105653.0,"When a structural-security authority finds himself set up and incarcerated in the world's most secret and secure prison, he has to use his skills to escape with help from the inside."
105720.0,"In Paris around 1900, Georges Randal is brought up by his wealthy uncle, who steals his inheritance. Georges hopes to marry his cousin Charlotte, but his uncle arranges for her to marry a rich neighbour. As an act of revenge, Georges steals the fiance's family jewels, and enjoys the experience so much that he embarks upon a life-time of burglary.::Will Gilbert"
105731.0,"A shy girl, outcasted by her peers and sheltered by her religious mother, unleashes telekinetic terror on her small town after being pushed too far at her senior prom."
105746.0,"UnHung Hero charts a humiliated man's fact-finding journey as he consults porn stars, doctors and anthropologists to learn whether the size of one's manhood matters."
105755.0,A lawyer finds himself in over his head when he gets involved in drug trafficking.
105801.0,"In a world of fake castles and anthropomorphic rodents, an epic battle begins when an unemployed father's sanity is challenged by a chance encounter with two underage girls on holiday."
105835.0,"A clerk in a government agency finds his unenviable life takes a turn for the horrific with the arrival of a new co-worker who is both his exact physical double and his opposite - confident, charismatic and seductive with women."
105844.0,"In the antebellum United States, Solomon Northup, a free black man from upstate New York, is abducted and sold into slavery."
105954.0,"After a collision with a shipping container at sea, a resourceful sailor finds himself, despite all efforts to the contrary, staring his mortality in the face."
106002.0,"Young Ender Wiggin is recruited by the International Military to lead the fight against the Formics, an insectoid alien race who had previously tried to invade Earth and had inflicted heavy losses on humankind."
106062.0,"86-year-old Irving Zisman takes a trip from Nebraska to North Carolina to take his 8 year-old grandson, Billy, back to his real father."
106072.0,"When the Dark Elves attempt to plunge the universe into darkness, Thor must embark on a perilous and personal journey that will reunite him with doctor Jane Foster."
106100.0,"In 1985 Dallas, electrician and hustler Ron Woodroof works around the system to help AIDS patients get the medication they need after he is diagnosed with the disease."
106144.0,Two thirteen year-old working-class friends in Bradford seek fortune by getting involved with a local scrap dealer and criminal.
106330.0,Four friends take a break from their day-to-day lives to throw a bachelor party in Las Vegas for their last remaining single pal.
106438.0,"A world-weary political journalist picks up the story of a woman's search for her son, who was taken away from her decades ago after she became pregnant and was forced to live in a convent."
106441.0,"While subjected to the horrors of World War II Germany, young Liesel finds solace by stealing books and sharing them with others. In the basement of her home, a Jewish refugee is being protected by her adoptive parents."
106487.0,Katniss Everdeen and Peeta Mellark become targets of the Capitol after their victory in the 74th Hunger Games sparks a rebellion in the Districts of Panem.
106489.0,"The dwarves, along with Bilbo Baggins and Gandalf the Grey, continue their quest to reclaim Erebor, their homeland, from Smaug. Bilbo Baggins is in possession of a mysterious and magical ring."
106491.0,A band of samurai set out to avenge the death and dishonor of their master at the hands of a ruthless shogun.
106540.0,An affable underachiever finds out he's fathered 533 children through anonymous donations to a fertility clinic 20 years ago. Now he must decide whether or not to come forward when 142 of them file a lawsuit to reveal his identity.
